week01/day01/output/summary_table.csv

variable,mean,median,sd,min,max,n_missing
time,305.23,255.5,210.65,5,1022,0
age,62.45,63,9.07,39,82,0
ph.karno,81.94,80,12.33,50,100,1
pat.karno,79.96,80,14.62,30,100,3
meal.cal,928.78,975,402.17,96,2600,47
wt.loss,9.83,7,13.14,-24,68,14

week01/day01/report.md

### Key findings

* The mean of survival time was 305.23 days with considerable spread (the standard deviation was 210.65 days)
* There were more than 70% of participants having the event of interest (death) at the end of the observation period
* The study population mostly consisted of the old group ($\geq$ 60 years old) with the mean is 62.45 years old and standard deviation of 9.07
* There were more male participants (60.5%) than female participants (39.5%) in the study population
* The distributions of Karnofsky performance score were quite similar between scores rated by physician and scores rated by participant. The mean scores were 81.94 and 79.96, respectively and the standard deviations were 12.33 and 14.62, respectively. The scores rated by participants were slightly lower and slightly more spread than those rated by physician